惠州市蓝湾环境科技有限公司,91441302MA52X92211,广东省-惠州市-惠城区-江北三新22号小区（厂房第2栋）2层之一,2,8,正常公开,1:2019:0,2:2020:0,3:2021:5,4:2022:0,5:2023:0
源青净信息科技（苏州）有限公司,91320507313779780Y,江苏省-苏州市-相城区-太平街道蠡太路70号聚金工业坊2号厂房2-3层,2,5,正常公开,1:2019:0,2:2020:0,3:2021:0,4:2022:0,5:2023:0
青岛英华环境服务有限公司,91370282MA3RLLCD1X,山东省-青岛市-即墨市-环秀街道湘江二路78-2D,2,1,正常公开,1:2021:0,2:2022:0,3:2023:5,4::-,5::-
湖北万瑞环保有限公司,91420624798781589R,湖北省-襄阳市-高新技术产业开发区-庞德路66号1号楼B区6楼,2,8,正常公开,1:2019:0,2:2020:0,3:2021:0,4:2022:5,5:2023:0
河南橦华生态环境设计院有限公司,91410411MA4759387R,河南省-平顶山市-高新技术开发区-建设路660号附3,2,10,正常公开,1:2022:5,2:2023:0,3::-,4::-,5::-
安徽棣泽环保科技有限公司,91340102MA2T6E3E13,安徽省-合肥市-包河区-湖北路627号利港银河幸福广场C座2108室,2,6,正常公开,1:2021:0,2:2022:0,3:2023:0,4:2024:0,5::-
沈阳熠珺环保科技有限公司,91210106335682699B,辽宁省-沈阳市-铁西区-路官二街2甲号607,2,1,守信名单,1:2019:0,2:2020:0,3:2021:0,4:2022:0,5:2023:0
陕西中绘工程技术有限公司,91610102MA6W2PWE42,陕西省-西安市-新城区-长乐西路166号朝阳国际C座1909室,2,5,正常公开,1:2019:0,2:2020:8,3:2021:0,4:2022:5,5:2023:0
山西众环环保咨询有限公司,91149900MA0KU18J8X,山西省-太原市-山西转型综改示范区-太原学府园区体育南路95号北美创意财富中心第6幢1单元6层05号,2,4,正常公开,1:2019:0,2:2020:0,3:2021:0,4:2022:5,5:2023:0
北海新吉星生态环境工程有限公司,91450500MA5P7Q139J,广西壮族自治区-北海市-海城区-北京路120明峰大厦0601号,2,1,正常公开,1:2019:0,2:2020:0,3:2021:0,4:2022:0,5:2023:0
山东金熙环保科技有限公司,91370102307246451J,山东省-济南市-历下区-经十路10567号成城大厦B座405室,2,9,正常公开,1:2019:0,2:2020:0,3:2021:0,4:2022:0,5:2023:0
广西柳地环保科技有限公司,91450200MA5NYCC286,广西壮族自治区-柳州市-柳北区-友谊路5号原地委组织部办公楼第五层第1.2.3.4.5号,2,7,正常公开,1:2019:0,2:2020:0,3:2021:0,4:2022:0,5:2023:0
江西穹境环保有限公司,91360106MA37QAXJ3N,江西省-南昌市-南昌高新技术产业开发区-昌东大道力高雍湖国际19＃办公楼二楼227室,2,6,正常公开,1:2019:0,2:2020:0,3:2021:0,4:2022:0,5:2023:0
新疆金咨源建设项目管理咨询有限公司,91650104062096351J,新疆维吾尔自治区-乌鲁木齐市-新市区-天津北路162号紫金长安小区南区5号楼2单元1301室,2,2,正常公开,1:2020:5,2:2021:0,3:2022:0,4:2023:5,5:2024:0
海南州领环环境科技有限公司,91632521MA758W2WXX,青海省-海南藏族自治州-共和县-恰卜恰镇海南州人力资源和社会保障局综合办公大楼1楼创业孵化中心（共和县城北新区和悦路）第13,2,7,正常公开,1:2020:0,2:2021:0,3:2022:5,4:2023:0,5::-
泉州市时代环保科技有限公司,91350504MA32WUJNXD,福建省-泉州市-洛江区-万安街道万安开发区万祥街67号远南商务大厦A幢6层01室,2,3,正常公开,1:2021:0,2:2022:0,3:2023:0,4::-,5::-
山东盈霖环境科技有限公司,91370602MA3NFGPX80,山东省-烟台市-莱山区-观海路71号3号楼1楼,2,14,正常公开,1:2019:0,2:2020:0,3:2021:0,4:2022:0,5:2023:0
南阳佳景环保科技有限公司,91411303MA9GD70D4Y,河南省-南阳市-卧龙区-光武街道人民北路东华新村一号楼三单元1501室,2,2,正常公开,1:2021:0,2:2022:5,3:2023:0,4::-,5::-
贵州华瑞铭科工程咨询有限公司,91520103MA6E2FAN42,贵州省-贵阳市-观山湖区-观山西路中储粮大厦办公楼二楼,2,3,正常公开,1:2019:3,2:2020:5,3:2021:5,4:2022:5,5:2023:0
安徽晋杰环境科技有限公司,91340104MA2UXX462H,安徽省-合肥市-蜀山区-合肥市蜀山区翡翠路1599号海雨大厦704,2,6,守信名单,1:2021:0,2:2022:0,3:2023:0,4::-,5::-
湖南义格环保科技有限公司,91430111MA4T3QA953,湖南省-长沙市-雨花区-雨花区金海路128号领智工业园A9栋401号,2,4,正常公开,1:2021:0,2:2022:0,3:2023:0,4::-,5::-
山东华汇达工程技术服务有限公司,91370100MA3MY3E480,山东省-济南市-高新技术产业开发区-工业南路61号山钢新天地广场9号楼804室,2,5,正常公开,1:2019:0,2:2020:2,3:2021:5,4:2022:0,5:2023:0
哈尔滨玖时工程咨询有限公司,91230103MA1BK0E4X4,黑龙江省-哈尔滨市-松北区-利民开发区利民大道西、南京路北幸福港湾一期9栋1单元10层3号,2,3,正常公开,1:2020:0,2:2021:0,3:2022:5,4:2023:0,5::-
河北博信环境科技有限公司,91130400MA0EFG2J3H,河北省-唐山市-路北区-河北省唐山市路北区南新道与光明路交叉口西行200米,2,2,守信名单,1:2020:0,2:2021:0,3:2022:0,4:2023:0,5:2024:0
新疆智联博宏环保工程有限公司,91650104MA77MUA1X9,新疆维吾尔自治区-乌鲁木齐市-新市区-长沙路新天巷1号3楼309-1室,2,9,正常公开,1:2020:5,2:2021:0,3:2022:0,4:2023:0,5:2024:0
北京京瑞博兴环保科技有限公司,91110101MA01N2GX09,北京市-北京市-丰台区-城南嘉园益城园16号楼12层2-1212,2,1,正常公开,1:2020:0,2:2021:0,3:2022:0,4:2023:0,5::-
广西华之南工程管理服务有限公司,9145010007196849X6,广西壮族自治区-南宁市-西乡塘区-高新大道55号南宁安吉万达广场6栋2628号,2,5,正常公开,1:2019:0,2:2020:0,3:2021:0,4:2022:0,5:2023:0
恒特技术咨询（云南）有限公司,91530602MABY6H971Q,云南省-昭通市-昭阳区-凤凰街道办事处鲁甸路21号,2,9,正常公开,1:2022:0,2:2023:0,3::-,4::-,5::-
锡林郭勒盟格林蓝环境科技有限公司,91152502MA0N07U83P,内蒙古自治区-锡林郭勒盟-锡林浩特市-额吉淖尔路伊特格勒社区环宇1号楼4单元102号,2,3,正常公开,1:2021:0,2:2022:0,3:2023:0,4::-,5::-
江西六佳环保科技有限公司,91360902MA39092U3A,江西省-宜春市-袁州区-中山东路东投中央城1栋608室,2,2,正常公开,1:2020:0,2:2021:0,3:2022:2,4:2023:5,5::-
山东碧霄环保节能科技有限公司,91370100568106588U,山东省-济南市-历下区-经十路17703号华特广场C510室,2,10,正常公开,1:2019:0,2:2020:0,3:2021:0,4:2022:0,5:2023:0
云南江楚环保科技有限公司,91530111MA6PAN5506,云南省-昆明市-官渡区-环城南路108号东来大厦16楼A座,2,6,正常公开,1:2020:0,2:2021:0,3:2022:0,4:2023:0,5::-
盐城满天星环境科技有限公司,91320902MA1XJ55J37,江苏省-盐城市-亭湖区-中亭路9号悦城花园3幢2-611室（18）,2,7,正常公开,1:2020:0,2:2021:0,3:2022:5,4:2023:0,5::-
重庆泓泰和正生态环境科技有限公司,91500000MA5YXLWY66,重庆市-重庆市-渝北区-龙溪街道金山路18号中渝都会首站3幢30-6,2,4,正常公开,1:2019:0,2:2020:0,3:2021:0,4:2022:0,5:2023:0
苏州云水净环境工程有限公司,91320594MA1MJ2DW25,江苏省-苏州市-吴中区-经济开发区兴南路21号创佳产业园1号楼305室,2,8,正常公开,1:2021:0,2:2022:0,3:2023:0,4::-,5::-
沈阳万益安全科技有限公司,91210100410711497G,辽宁省-沈阳市-沈河区-泉园街22号,2,8,正常公开,1:2019:0,2:2020:0,3:2021:5,4:2022:0,5:2023:0
唐山山水项目管理有限公司,91130203MA08TG786K,河北省-唐山市-路北区-草场街北侧汉斯昆德故居博物馆东侧房屋1F00-2号102,2,3,守信名单,1:2019:0,2:2020:0,3:2021:0,4:2022:0,5:2023:0
青岛胶州湾环境工程有限公司,9137021178755580X7,山东省-青岛市-黄岛区-世纪大道1003号,2,4,正常公开,1:2019:0,2:2020:10,3:2021:8,4:2022:0,5:2023:0
潍坊同顺工程咨询有限公司,91370784MA3DAG7074,山东省-潍坊市-安丘市-安丘市大汶河旅游开发区金融中心A座18楼1811-1812室,2,2,正常公开,1:2022:0,2:2023:0,3:2024:0,4::-,5::-
辽宁绿管家环保科技有限公司,91210100MA0XLD7E6R,辽宁省-沈阳市-浑南区-世纪路同方世纪大厦B座2501室,2,16,正常公开,1:2019:0,2:2020:0,3:2021:0,4:2022:0,5:2023:0
河南首创环保科技有限公司,9141010055693110X5,河南省-郑州市-上街区-汝南路1号奥瑞科技产业园6号楼5层,2,5,正常公开,1:2019:0,2:2020:5,3:2021:0,4:2022:0,5:2023:0
潍坊绿诚环保咨询有限公司,91370700334252654P,山东省-潍坊市-高新技术产业开发区-新城街道北海社区东风东街5738号清荷园12号综合楼2-1907-1,2,1,正常公开,1:2019:0,2:2020:0,3:2021:0,4:2022:5,5:2023:0
桂林百嘉环保技术服务有限公司,91450322MA5LBGWD95,广西壮族自治区-桂林市-临桂区-西城北路10号山水凤凰城D5幢2单元9层3号,2,5,正常公开,1:2020:0,2:2021:0,3:2022:0,4:2023:0,5::-
渭南华山环保科技发展有限责任公司,91610500054770262W,陕西省-渭南市-临渭区-朝阳中路12号,2,6,正常公开,1:2019:0,2:2020:5,3:2021:0,4:2022:0,5:2023:0
广西欣文环保科技有限公司,91450102MA5NWU759L,广西壮族自治区-南宁市-兴宁区-民主路8号斯壮大厦（原官塘大厦）九层902、903、904、905号房,2,5,正常公开,1:2020:0,2:2021:0,3:2022:0,4:2023:0,5::-
长兴佳园商务咨询有限公司,91330522344073625C,浙江省-湖州市-长兴县-太湖街道振力大厦1601室,2,6,正常公开,1:2020:0,2:2021:0,3:2022:0,4:2023:0,5::-
重庆市久久环境影响评价有限公司,915002425842800176,重庆市-重庆市-高新区-金凤镇凤德路10号1＃楼房第四层409-92室,2,5,正常公开,1:2019:0,2:2020:5,3:2021:7,4:2022:2,5:2023:2
唐山聚晨环保科技有限公司,91130293MA0ERNQX55,河北省-唐山市-高新技术开发区-唐山市高新区建设北路152-1号时代大厦2号楼第18层1805-2室,2,6,守信名单,1:2020:0,2:2021:0,3:2022:0,4:2023:0,5::-
内蒙古盛汇环境科技有限公司,91150105MA0Q21HH19,内蒙古自治区-呼和浩特市-赛罕区-鄂尔多斯东街发展小区20号楼东单元601,2,2,正常公开,1:2019:0,2:2020:0,3:2021:5,4:2022:0,5:2023:0
上海环安环境管理有限公司,91310230550090776Y,上海市-上海市-崇明区-兴工路18号2号楼151室,2,8,正常公开,1:2019:0,2:2020:0,3:2021:0,4:2022:0,5:2023:0
安徽康安宏润环保科技有限公司,91340100MA2Q3D0KXD,安徽省-合肥市-包河区-紫云路与徽二路交口滨湖品阁,2,9,守信名单,1:2019:0,2:2020:0,3:2021:0,4:2022:0,5:2023:0
广州德源环保科技有限公司,91440101MA59JN4225,广东省-广州市-白云区-尖彭路371号有趣社区B栋208室,2,11,正常公开,1:2019:0,2:2020:5,3:2021:5,4:2022:5,5:2023:0
浙江省环境工程有限公司,91330000142910886B,浙江省-杭州市-西湖区-黄姑山路9号6-7楼,2,7,正常公开,1:2019:0,2:2020:0,3:2021:0,4:2022:5,5:2023:0
吉林省云鹤环保科技有限公司,91220107MA170N3C5T,吉林省-长春市-长春高新区-硅谷大街3355号硅谷商务501A,2,9,守信名单,1:2019:0,2:2020:0,3:2021:0,4:2022:0,5:2023:0
曲靖市子锋环评咨询有限公司,91530302316339887J,云南省-曲靖市-麒麟区-麒麟西路59号石油东生活区7栋（物业大楼2-4层）,2,8,正常公开,1:2019:0,2:2020:0,3:2021:0,4:2022:0,5:2023:0
三明市韬睿环保技术有限公司,91350402077408020X,福建省-三明市-三元区-新市北路736号沪明新村12幢921-922室,2,2,正常公开,1:2019:0,2:2020:0,3:2021:0,4:2022:5,5:2023:0
山东鲁蒙环境服务有限公司,91370303MA3PKEJU9N,山东省-淄博市-张店区-科苑街道办事处柳泉路232号潘馨园3号楼5层505室,2,1,正常公开,1:2020:0,2:2021:0,3:2022:0,4:2023:0,5::-
酒泉玖时环境咨询有限责任公司,91620902MA73T8E44Q,甘肃省-酒泉市-肃州区-瓜州路17号中天岁月魔方1号楼1-8-1,2,4,正常公开,1:2021:0,2:2022:5,3:2023:0,4::-,5::-
山西晋瑞清环保科技有限责任公司,91140802MA0K3P6C6K,山西省-运城市-盐湖区-解放南路钟楼小区45号商务楼B栋706室,2,2,正常公开,1:2020:0,2:2021:0,3:2022:5,4:2023:0,5::-
安徽显闰环境科技有限公司,91340104MA8MYU7974,安徽省-合肥市-蜀山区-新产业园湖光路1号1-1002室,2,7,正常公开,1:2021:0,2:2022:0,3:2023:0,4::-,5::-
河南环华生态科技有限公司,91410105MA481KU88U,河南省-郑州市-郑州东区-博学路277号2号楼21层2104号,2,3,正常公开,1:2020:0,2:2021:5,3:2022:0,4:2023:0,5::-
安徽海智博天环保科技股份有限公司,91340200MA2REGYW33,安徽省-芜湖市-弋江区-金鹰世界中心写字楼1404-1406,2,7,守信名单,1:2019:0,2:2020:0,3:2021:0,4:2022:0,5:2023:0
浙江天耀环保科技有限公司,91330106MA2HXFFW4N,浙江省-杭州市-西湖区-五洲国际商业中心3幢1119室,2,2,正常公开,1:2020:0,2:2021:0,3:2022:0,4:2023:0,5::-
湖南弘敏咨询有限公司,91430112MA4TEBU59H,湖南省-长沙市-望城区-月亮岛街道富基世纪公园37＃、38＃栋1709室,2,5,正常公开,1:2021:0,2:2022:0,3:2023:0,4::-,5::-
山东煜宁环保科技有限公司,91370303MA3QXX8FXU,山东省-淄博市-高新技术产业开发区-万杰路108号博士楼909室,2,3,正常公开,1:2021:0,2:2022:0,3:2023:0,4::-,5::-
四川洋舟环保科技有限公司,91510107MA61W9GP47,四川省-成都市-武侯区-武青西一路12号,2,1,正常公开,1:2019:0,2:2020:0,3:2021:5,4:2022:0,5:2023:5
山西铭淼合创环保科技有限公司,91140100MA0JXEH19L,山西省-太原市-万柏林区-红沟路2号（西山煤电高新技术产业发展中心）,2,8,正常公开,1:2019:0,2:2020:0,3:2021:0,4:2022:0,5:2023:0
大连金泽安全环境科技有限公司,91210211MA0UE0P772,辽宁省-大连市-金普新区-淮河西路110号6号楼5层,2,6,正常公开,1:2019:0,2:2020:0,3:2021:0,4:2022:5,5:2023:0
湖南融泽生态环境科技有限公司,91430105MABMR1TYXT,湖南省-长沙市-开福区-美利新世界5栋1804,2,4,正常公开,1:2022:0,2:2023:0,3::-,4::-,5::-
江苏恒远环境科技有限公司,91320682MA1W0FBC76,江苏省-南通市-如皋市-如城街道志颐路99号,2,8,正常公开,1:2019:0,2:2020:0,3:2021:5,4:2022:0,5:2023:0
河南嘉煜博环保科技有限公司,91410105MA454TNC49,河南省-郑州市-郑州东区-河南省郑州市郑东新区永平路与康平路交叉口郑东商业中心C区1号楼1313室,2,4,正常公开,1:2021:0,2:2022:0,3:2023:0,4::-,5::-
佛山市宏哲环保科技有限公司,91440605MA57D7LH54,广东省-佛山市-南海区-狮山镇科技西路6号欧浦城市花园3座75号铺之一（住所申报）,2,4,正常公开,1:2021:0,2:2022:0,3:2023:0,4::-,5::-
四川时实环安科技有限公司,91510100MA7FEL381W,四川省-成都市-高新区-天府三街69号1栋7楼703号,2,2,正常公开,1:2022:0,2:2023:0,3::-,4::-,5::-
江西益聚环保科技有限公司,91360302MA39TB1F8G,江西省-萍乡市-萍乡经济技术开发区-江西省萍乡市萍乡经济技术开发区华美立家31栋3层22号,2,4,正常公开,1:2021:0,2:2022:0,3:2023:0,4::-,5::-
陕西中启生态技术有限公司,91611100MA6TKJDP2R,陕西省-西咸新区-沣东新城-三桥街办启航时代广场D座1405室-1406室,2,4,正常公开,1:2021:0,2:2022:0,3:2023:0,4::-,5::-
青岛斯坦德衡立环境技术研究院有限公司,91370214583686349X,山东省-青岛市-高新技术产业开发区-锦业路1号蓝贝智造工场C3-2、C3-3区域（环评办公地点丰茂路55号斯坦德集团总部）,2,3,正常公开,1:2019:0,2:2020:2,3:2021:0,4:2022:5,5:2023:5
湖南三方环境科技有限公司,91430111MA4L287J6K,湖南省-长沙市-雨花区-振华路519号聚合工业园15栋401房,2,29,正常公开,1:2019:0,2:2020:0,3:2021:0,4:2022:0,5:2023:0
扬州天时利环保科技有限公司,91321003MA1XB8UT9T,江苏省-扬州市-经济技术开发区-维扬路106-1号（商城国际大厦）C-1办公806,2,6,守信名单,1:2020:0,2:2021:0,3:2022:0,4:2023:0,5::-
湖北慧智环境科学研究有限公司,91421200MA487MYP0X,湖北省-咸宁市-咸安区-银桂路11号,2,5,正常公开,1:2019:0,2:2020:0,3:2021:0,4:2022:0,5:2023:0
温州中绿环保科技有限公司,91330324704359417H,浙江省-温州市-永嘉县-东城街道峙口溪头村（温州瓯潮洗涤有限公司内）,2,10,正常公开,1:2019:0,2:2020:0,3:2021:5,4:2022:0,5:2023:0
广州正润环境科技有限公司,91440101MA5ALK9Q4T,广东省-广州市-天河区-燕岭路89号2307房,2,5,正常公开,1:2019:0,2:2020:0,3:2021:0,4:2022:0,5:2023:0
广州蓝碧环境科学工程顾问有限公司,91440106725627150R,广东省-广州市-天河区-燕岭路120号702房,2,28,正常公开,1:2019:0,2:2020:0,3:2021:0,4:2022:0,5:2023:0
江西倍思特环保科技有限公司,91361002MA35THE6X0,江西省-抚州市-抚州高新技术产业开发区-创新创业服务中心A7栋3楼B1003＃办公室,2,2,正常公开,1:2021:0,2:2022:0,3:2023:0,4::-,5::-
广州茂绿环保科技有限公司,91440101MA59L47B43,广东省-广州市-花都区-秀全街瑞香路57号之二301房,2,3,正常公开,1:2019:0,2:2020:0,3:2021:8,4:2022:0,5:2023:0
湖南怀德全过程工程咨询有限公司,914307007170433152,湖南省-常德市-武陵区-湖南省常德市武陵区丹阳街道金桥社区丹阳路（登泰·丹霞苑4号楼15楼1501号）,2,5,正常公开,1:2022:0,2:2023:5,3::-,4::-,5::-
深圳市正源环保管家服务有限公司,91440300MA5F23HW9M,广东省-深圳市-龙岗区-宝龙街道宝龙社区宝荷大道76号智慧家园二期3A29楼2904,2,6,正常公开,1:2019:0,2:2020:5,3:2021:0,4:2022:0,5:2023:0
江苏润中工程设计咨询有限公司,91320303MA21WPJJ0L,江苏省-徐州市-云龙区-徐州市云龙区文博园,2,3,正常公开,1:2022:0,2:2023:0,3::-,4::-,5::-
广西禾立源工程咨询有限公司,91450103MA5NDJFR6N,广西壮族自治区-南宁市-青秀区-金湖路59号地王国际商会中心3108号,2,6,正常公开,1:2020:0,2:2021:0,3:2022:0,4:2023:0,5::-
云平台（山西）科技股份有限公司,91140110MA0K50838K,山西省-太原市-山西转型综改示范区-科技创新城化章北街1号山西数据流量生态园4号楼4层4409-176,2,13,正常公开,1:2019:0,2:2020:0,3:2021:0,4:2022:0,5:2023:0
浙江科越生态环境科技有限公司,91330382MABX67DQ4E,浙江省-温州市-乐清市-温州市乐清市乐成街道阳光大厦2幢1604室,2,6,正常公开,1:2023:0,2::-,3::-,4::-,5::-
山西中绿晋玫环保科技有限公司,91140100MA0KX44P6J,山西省-太原市-万柏林区-长兴路1号华润大厦T3栋20层2013号,2,6,正常公开,1:2020:0,2:2021:0,3:2022:0,4:2023:0,5::-
广东瑞星环境科技有限公司,914419007820378868,广东省-东莞市-东莞-厚街镇厚街大道西115号,2,4,正常公开,1:2019:0,2:2020:0,3:2021:0,4:2022:0,5:2023:0
陕西优和安环工程咨询有限公司,91610103397556217H,陕西省-西安市-碑林区-环城南路东段334号宏信国际花园2号楼2单元706室,2,14,正常公开,1:2019:0,2:2020:5,3:2021:5,4:2022:5,5:2023:0
苏州环源环保科技有限公司,913205065642746058,江苏省-苏州市-吴中区-郭巷街道东环南路999号1幢117室,2,6,正常公开,1:2020:0,2:2021:0,3:2022:0,4:2023:0,5:2024:0
赤峰国环宏博节能环保科技有限公司,911504043413050802,内蒙古自治区-赤峰市-松山区-八家组团帝豪商务大厦A座1-1201,2,0,正常公开,1:2019:0,2:2020:0,3:2021:0,4:2022:0,5:2023:5
江西景瑞祥环保科技有限公司,91360400MA35GFPT1G,江西省-九江市-九江市经济技术开发区-恒盛科技园24栋,2,4,正常公开,1:2019:4,2:2020:23,3:2021:0,4:2022:0,5:2023:0
广东艾格芮生态科技有限公司,91441302MA538XEH02,广东省-惠州市-惠城区-河南岸街道金山大道17号万象天汇广场五期第14栋13层04号,2,3,正常公开,1:2020:0,2:2021:0,3:2022:0,4:2023:0,5::-
广州自然环保科技发展有限公司,91440101MA5CYBWM6J,广东省-广州市-白云区-嘉禾街广云路313号A12栋208房,2,5,正常公开,1:2019:0,2:2020:0,3:2021:0,4:2022:5,5:2023:0
江苏仁环安全环保科技有限公司,91320706MA25KQYG2Q,江苏省-连云港市-经济技术开发区-综合保税区综合楼419-1508号电话:0518-82312423,2,7,正常公开,1:2021:0,2:2022:0,3:2023:0,4::-,5::-
安徽省振环环境评价有限责任公司,91341394MA8NQ3EX1N,安徽省-宿州市-高新区-电子商务产业园3号楼5层2号,2,4,正常公开,1:2022:0,2:2023:0,3::-,4::-,5::-
浙江辐瑞环境科技有限公司,91330302MA2L61X993,浙江省-温州市-鹿城区-南汇街道温州大道悦尚大厦1幢,2,2,正常公开,1:2021:0,2:2022:0,3:2023:0,4::-,5::-
湖北安和威环保科技有限公司,91420100MA4L06XH9Q,湖北省-武汉市-洪山区-南湖大道53号洪山创业中心5楼5008室,2,12,正常公开,1:2019:0,2:2020:0,3:2021:0,4:2022:0,5:2023:0
江苏景顺环境科技有限公司,91320312MA1WAB9187,江苏省-徐州市-云龙区-徐州市云龙区绿地商务城（B7-5地块）商务办公楼1号楼1-1003,2,6,守信名单,1:2019:0,2:2020:0,3:2021:0,4:2022:0,5:2023:0
淮安普康环保有限公司,91320804MA1YGXNY16,江苏省-淮安市-淮阴区-台州商城9幢110营业用房,2,1,正常公开,1:2023:0,2:2024:0,3::-,4::-,5::-
山西中信科联环保科技有限公司,91140105MA0GUFP054,山西省-太原市-小店区-体育西路918号长风画卷B座1201房,2,5,正常公开,1:2019:0,2:2020:0,3:2021:0,4:2022:0,5:2023:0
陕西卓成天弘工程咨询有限公司,91610501MA6Y22MX5G,陕西省-渭南市-高新技术产业开发区-东兴街27号创新创业中心,2,3,正常公开,1:2019:0,2:2020:5,3:2021:5,4:2022:0,5:2023:0
山西正航环保科技有限公司,91149900MA0KFFEW9M,山西省-太原市-山西转型综改示范区-太原学府园区龙兴街192号1幢4层401室,2,9,正常公开,1:2019:0,2:2020:0,3:2021:0,4:2022:5,5:2023:0
陕西徳让环境科技有限公司,91610802MA70BURY1W,陕西省-榆林市-榆阳区-上郡路街道办事处德静路社区华奕大厦902,2,0,正常公开,1:2020:0,2:2021:0,3:2022:0,4:2023:0,5::-
云南德源绿创环保科技有限公司,915326215631944197,云南省-文山壮族苗族自治州-文山市-华宇卧龙府2幢201号,2,4,正常公开,1:2020:0,2:2021:0,3:2022:0,4:2023:0,5::-
山西安亿源环保科技有限公司,91140100MA0K108J7H,山西省-太原市-山西转型综改示范区-学府产业园科技街3号普天大厦A座14层1403室,2,8,正常公开,1:2019:0,2:2020:0,3:2021:0,4:2022:0,5:2023:0
唐山碧云环保科技有限公司,91130202MA0GE3K384,河北省-唐山市-路南区-河北省唐山市路南区长青里万达广场23楼1122号,2,2,正常公开,1:2021:0,2:2022:0,3:2023:0,4::-,5::-
山西大成至远环保科技有限公司,91140700MA0HKKAY8T,山西省-晋中市-市辖区-山西省晋中市山西示范区晋中开发区大学城产业园区山西智慧科技城B14-01号楼,2,3,正常公开,1:2021:0,2:2022:0,3:2023:0,4::-,5::-
海南纳川能源环保科技有限公司,91460000MA5TFEAM6N,海南省-海口市-龙华区-学院东街3号和沐天成2号楼1101房,2,5,正常公开,1:2020:0,2:2021:0,3:2022:0,4:2023:0,5::-
上海华庾环保科技有限公司,91310104MA1FR49Y6X,上海市-上海市-奉贤区-沪杭公路1588号3号楼401室,2,3,正常公开,1:2019:0,2:2020:0,3:2021:0,4:2022:0,5:2023:0
新疆德聚仁合生态环境科技有限公司,91653101MA77TT37X1,新疆维吾尔自治区-喀什地区-喀什市-喀什经济开发区深喀大道总部经济区深圳城2号楼3层4-4号,2,0,正常公开,1:2021:0,2:2022:0,3:2023:0,4::-,5::-
威海宇华环保咨询有限公司,91371000MA3QF3MKX3,山东省-威海市-临港经济技术开发区-草庙子镇花果山（东院）,2,5,正常公开,1:2019:0,2:2020:0,3:2021:0,4:2022:0,5:2023:0
山东核辐环保技术有限公司,91370521326132652W,山东省-东营市-东营区-庐山路1188号华泰金融中心B座515室,2,0,正常公开,1:2020:0,2:2021:0,3:2022:0,4:2023:0,5::-
山东捷华环境科技有限公司,91370700MA3TD6CW4Y,山东省-潍坊市-寒亭区-通亭街7589号中国兽药饲料交易大厦,2,5,正常公开,1:2021:0,2:2022:0,3:2023:0,4::-,5::-
淮安诺涵环保信息咨询有限公司,91320830MA22YDA82R,江苏省-淮安市-盱眙县-合欢大道中央城市广场东门15-108室,2,4,正常公开,1:2021:0,2:2022:0,3:2023:5,4::-,5::-
安徽祥安环保有限公司,91340100394545299B,安徽省-合肥市-蜀山区-安徽省合肥市蜀山区长江西路297号金域华府写字楼1-707,2,5,正常公开,1:2020:0,2:2021:0,3:2022:0,4:2023:0,5::-
鸡西蓝天环保服务有限公司,91230300MA19LLT11G,黑龙江省-鸡西市-恒山区-恒馨家园6号楼5号门市,2,3,正常公开,1:2019:0,2:2020:0,3:2021:8,4:2022:0,5:2023:0
山东同方环境技术服务有限公司,91370303MA94K8AJ7J,山东省-淄博市-张店区-青年创业园A座305,2,5,正常公开,1:2021:0,2:2022:0,3:2023:2,4::-,5::-
山西运东环保科技有限公司,91140105MA0L4CDU96,山西省-太原市-小店区-平阳路1号金茂大厦B座20层,2,1,正常公开,1:2021:0,2:2022:0,3:2023:0,4::-,5::-
常州久远环境工程技术有限公司,913204046696044046,江苏省-常州市-钟楼区-怀德中路48-1204,2,4,正常公开,1:2019:0,2:2020:0,3:2021:0,4:2022:5,5:2023:0
四川羽嘉环境技术有限公司,91510100MA69RTX881,四川省-成都市-天府新区-华阳滨河路二段368号3栋1层105,2,10,正常公开,1:2020:5,2:2021:0,3:2022:0,4:2023:0,5::-
吉林省泓淇环保发展有限公司,91220102MA177RYE83,吉林省-长春市-南关区-卫星路6520号星城国际A座1706室,2,0,正常公开,1:2019:5,2:2020:0,3:2021:0,4:2022:0,5:2023:0
广东辰宇生态环保科技有限公司,91440101MA9W2TQT5K,广东省-广州市-越秀区-东风东路836号二座1104单元,2,2,正常公开,1:2021:0,2:2022:0,3:2023:0,4::-,5::-
佛山市南粤水土环境技术有限公司,91440604MA546EP26Y,广东省-佛山市-禅城区-张槎街道季华一路智慧新城T16栋909号,2,4,正常公开,1:2022:0,2:2023:0,3::-,4::-,5::-
云南国琨环保科技有限公司,91530100099096494E,云南省-昆明市-国家高新技术产业开发区-二环西路398号高新科技信息中心主楼,2,19,正常公开,1:2019:0,2:2020:0,3:2021:0,4:2022:0,5:2023:0
