青岛国海浩瀚海洋工程咨询有限公司,91370212MA3CJWK95A,山东省-青岛市-崂山区-株洲路88号海信财智谷1号楼1203B,1,6,正常公开,1:2019:0,2:2020:2,3:2021:0,4:2022:0,5:2023:0
国环（广东）生态科技有限公司,91440106MA59DAPX1L,广东省-广州市-海珠区-昌岗中路238号1215房,1,1,正常公开,1:2022:0,2:2023:0,3:2024:0,4::-,5::-
昆明龙慧工程设计咨询有限公司,915301007755224961,云南省-昆明市-经济技术开发区-洛羊街道办大洛羊社区信息产业基地13-2号海归创业园1栋5楼530、532号,1,14,正常公开,1:2023:0,2:2024:0,3::-,4::-,5::-
宁夏合吉顺生态环境有限公司,91640105MA75W0BB9K,宁夏回族自治区-银川市-金凤区-满城南街与长城中路交汇处福满苑4号楼2单元401室及阁楼(自主申报),1,2,正常公开,1:2023:0,2::-,3::-,4::-,5::-
陕西延之州工程咨询有限公司,91610131MAC4JP2N5W,陕西省-西安市-高新技术产业开发区-西安市高新区唐延路旺座现代城F座903室,1,4,正常公开,1:2023:0,2:2024:0,3::-,4::-,5::-
陕西昊汉环境科技有限公司,91610100333756519D,陕西省-西安市-雁塔区-罗家寨90号5-1号,1,2,正常公开,1:2020:0,2:2021:0,3:2022:0,4:2023:0,5::-
云南锦霖环境科技有限公司,91530100MAC6RENJ1W,云南省-昆明市-滇池国家旅游度假区-华都花园二期20幢3单元1301号,1,0,正常公开,1:2023:0,2::-,3::-,4::-,5::-
四川格律环保科技有限公司,91510603MAACL9EB4N,四川省-德阳市-市辖区-辽河街40号冶轴文创园7号楼7-208,1,1,正常公开,1:2023:0,2::-,3::-,4::-,5::-
唐山奥米卡科技有限公司,91130223MA7F2QXM57,河北省-唐山市-滦县-滦城街道办事处平青北路6号12层1210,1,3,正常公开,1:2022:0,2::-,3::-,4::-,5::-
武汉众一环保科技有限公司,91420111MA49HY9F8L,湖北省-武汉市-洪山区-书城路26号洪山科技创业中心B栋612,1,0,正常公开,1:2021:0,2:2022:8,3:2023:0,4::-,5::-
赤峰安环技术咨询有限公司,91150404096707069U,内蒙古自治区-赤峰市-红山区-小新地组团金融一街南、学院北路北、金融一路东金石矿业广场1-1-1-1805,1,0,正常公开,1:2023:0,2:2024:0,3::-,4::-,5::-
广西环济技术咨询有限公司,91450100MA5QBCD3XT,广西壮族自治区-南宁市-青秀区-东葛路118号南宁青秀万达广场东3栋二十二层2202号房,1,1,正常公开,1:2023:0,2::-,3::-,4::-,5::-
广州市湃森环境咨询服务有限公司,91440101MA59RT043N,广东省-广州市-黄埔区-敏盛街6号1103房,1,4,正常公开,1:2020:0,2:2021:0,3:2022:0,4:2023:0,5::-
岳阳市优源环保工程有限公司,91430600MA4LLBXG9L,湖南省-岳阳市-岳阳楼区-湖南省岳阳市岳阳楼区古井社区古井组1号4楼,1,3,正常公开,1:2021:0,2:2022:0,3:2023:0,4::-,5::-
四川万方和工程咨询有限公司,91510100092834095Y,四川省-成都市-高新区-肖家河中街44号9幢1层,1,4,正常公开,1:2021:0,2:2022:0,3:2023:0,4::-,5::-
山东国鑫环境科学研究院有限公司,91371400MA3UUXB971,山东省-德州市-德城区-天衢街道办事处新湖北路22号办公楼201室,1,5,正常公开,1:2021:0,2:2022:0,3:2023:5,4::-,5::-
北京圣洁英博环境工程有限公司,91110102MA001JXJXE,北京市-北京市-朝阳区-北京市朝阳区北苑路34号,1,2,正常公开,1:2021:0,2:2022:0,3:2023:0,4::-,5::-
唐山俊才环境科技有限公司,91130203MA0FTJJ01T,河北省-唐山市-路北区-融融商务中心综合楼3-02号,1,2,正常公开,1:2022:0,2:2023:0,3::-,4::-,5::-
陕西利新环保科技有限公司,91610824MA703B313J,陕西省-榆林市-靖边县-统万路县委城建家属院7号楼2单元402室,1,0,正常公开,1:2019:0,2:2020:0,3:2021:5,4:2022:0,5:2023:0
吉林省普爱津科技有限公司,91220100MACDN66A2M,吉林省-长春市-长春高新区-长春市高新开发区硅谷西街与佳园路交汇处帝豪巴赫丽舍6栋1602号,1,0,正常公开,1:2023:0,2::-,3::-,4::-,5::-
四川川利全过程工程咨询有限公司,91510800MABY53KX0D,四川省-广元市-利州区-万源新区广电中心南侧、市政务中心西侧恒业锦城三期13栋5-12,1,2,正常公开,1:2023:0,2::-,3::-,4::-,5::-
福建安成环保科技有限公司,91350103MACF8L0R4M,福建省-福州市-台江区-荷泽巷32-1号6号楼3B-1室,1,0,正常公开,1:2023:0,2::-,3::-,4::-,5::-
沈阳鸿嘉生态环境咨询有限公司,91210102MACLKD9E47,辽宁省-沈阳市-和平区-北市一街7号F5-C2252房间,1,0,正常公开,1:2023:0,2::-,3::-,4::-,5::-
洛阳启帆环保科技有限公司,91410307MA9FT1AJ7A,河南省-洛阳市-洛龙区-永泰街179号建业龙城9幢1203,1,1,正常公开,1:2023:0,2::-,3::-,4::-,5::-
肇庆鼎环生态环境科技有限公司,91441283MAC8R24Q74,广东省-肇庆市-高要区-金渡镇世纪大道8号之一生生粮食加工厂综合楼二楼第五卡,1,0,正常公开,1:2023:2,2::-,3::-,4::-,5::-
江西波罗蜜环保科技有限公司,91361102MACKK8QJ91,江西省-上饶市-信州区-滨江西路66号1、2、3、5幢2＃607,1,0,正常公开,1:2023:0,2::-,3::-,4::-,5::-
惠州市六一环境科技有限公司,91441302MA568NRH9H,广东省-惠州市-惠城区-华贸中心7号楼703房,1,2,正常公开,1:2023:0,2::-,3::-,4::-,5::-
赤壁市工程咨询评估有限公司,91421281MA49F5NJXC,湖北省-咸宁市-赤壁市-湖北省咸宁市赤壁市赤马港河大道152号,1,1,正常公开,1:2020:0,2:2021:0,3:2022:0,4:2023:0,5::-
中国市政工程华北设计研究总院有限公司,911200004013602422,天津市-天津市-河西区-气象台路99号,9,6,正常公开,1:2019:0,2:2020:0,3:2021:0,4:2022:0,5:2023:0
江西盛嘉技术咨询服务有限公司,91360108314763502Y,江西省-南昌市-青山湖区-上坊路382号江西省科学院综合楼906-909室。,3,9,正常公开,1:2021:5,2:2022:0,3:2023:0,4::-,5::-
漯河锦润环境科技有限公司,91411103MA46UG8WXK,河南省-漯河市-郾城区-河南省漯河市郾城区嵩山路沙田锦绣天地19＃楼19幢1908号,3,6,正常公开,1:2020:0,2:2021:0,3:2022:0,4:2023:0,5::-
湖北景宜环保科技有限公司,91421300326026702N,湖北省-随州市-曾都区-随州市西城双龙寺清河路南综合楼2楼,3,5,正常公开,1:2019:0,2:2020:0,3:2021:0,4:2022:0,5:2023:0
广西南咨环境技术有限公司,91450103MA5K98Q51N,广西壮族自治区-南宁市-青秀区-建政路10号综合大楼第三层南侧办公室,3,10,正常公开,1:2019:0,2:2020:0,3:2021:0,4:2022:0,5:2023:0
大连市润环环保产业基地管理有限公司,91210211MA0U6W215T,辽宁省-大连市-甘井子区-金新路1号,3,7,正常公开,1:2019:0,2:2020:0,3:2021:5,4:2022:0,5:2023:0
山东省分析测试中心,123700004955406069,山东省-济南市-历下区-科院路19号,3,2,正常公开,1:2021:0,2:2022:0,3:2023:0,4::-,5::-
交通运输部长江航务管理局环境监测中心站,124200007775927705,湖北省-武汉市-江岸区-解放大道1262号,3,3,正常公开,1:2022:0,2:2023:0,3::-,4::-,5::-
河南莱嘉环境技术有限公司,91410105MACCQ57Q21,河南省-郑州市-金水区-河南省郑州市金水区经三路北32号财富广场1号楼18层196号,3,2,正常公开,1:2023:0,2::-,3::-,4::-,5::-
吉林恒升环境科技有限公司,91220211MA172QEG7F,吉林省-吉林市-丰满区-滨江东路1号江南壹号花园B5号楼2号网点,2,5,守信名单,1:2019:0,2:2020:0,3:2021:0,4:2022:0,5:2023:0
四川兴环科环保技术有限公司,91510700MA624BPK4U,四川省-绵阳市-科技城科教创业园区-创新中心3号楼217室,2,12,正常公开,1:2019:2,2:2020:5,3:2021:5,4:2022:0,5:2023:0
江苏博晟环境科技有限公司,91320115MA25L7RC9W,江苏省-南京市-江宁区-秣陵街道秣周东路12号R403（实际办公地址：南京市江宁区南京南站城际空间站H1-301室）,2,8,守信名单,1:2021:0,2:2022:0,3:2023:0,4::-,5::-
柯麦龙科技（温州）有限公司,91330303MA2L3XMD2M,浙江省-温州市-龙湾区-永中街道永中西路1158号金属大厦907室,2,5,正常公开,1:2022:0,2:2023:0,3::-,4::-,5::-
河南青水环境科技有限公司,91410611MA442LMF98,河南省-鹤壁市-经济技术开发区-延河路228号,2,9,正常公开,1:2019:0,2:2020:0,3:2021:2,4:2022:5,5:2023:5
河南洁达环保投资有限公司,914113035724587039,河南省-南阳市-宛城区-溧河乡涧河西路836号,2,6,正常公开,1:2019:0,2:2020:0,3:2021:5,4:2022:0,5:2023:0
苏神环境技术（上海）有限公司,91310117MA1J1M9RXK,上海市-上海市-闵行区-新龙路1333弄66号520室,2,0,正常公开,1:2022:0,2:2023:0,3::-,4::-,5::-
安徽泰飞技术服务有限公司,91340103MA2W933300,安徽省-合肥市-庐阳区-工投创智天地产业园A16栋4楼,2,6,守信名单,1:2021:0,2:2022:0,3:2023:0,4::-,5::-
四川中环康源卫生技术服务有限公司,91510100782288124U,四川省-成都市-高新区-成都高新区科园南路5号,2,11,正常公开,1:2021:0,2:2022:0,3:2023:0,4::-,5::-
扬州市兴创环境科技有限公司,91321002MA1XMJGJ88,江苏省-扬州市-广陵区-创新中心A座9层,2,10,正常公开,1:2019:0,2:2020:0,3:2021:0,4:2022:0,5:2023:0
辽宁中咨华宇环保技术有限公司,9121010456469129XW,辽宁省-沈阳市-浑南区-中国（辽宁）自由贸易试验区沈阳片区创新二路39-1号606室,2,12,正常公开,1:2019:0,2:2020:0,3:2021:0,4:2022:5,5:2023:0
四川立明环创环保科技有限公司,91510600MA64CRFY4W,四川省-德阳市-市辖区-蓥华南路一段80号滨湖之春3栋3-38-2号,2,3,正常公开,1:2022:0,2:2023:0,3::-,4::-,5::-
河南启新环保科技有限公司,91410400MA4846F56Y,河南省-平顶山市-新华区-湖滨路街道长安大道蓝湾国际大厦东二单元14楼南户,2,2,正常公开,1:2020:0,2:2021:5,3:2022:0,4:2023:0,5::-
云南天礴环保服务有限公司,91530100MA6PB6A19G,云南省-昆明市-官渡区-春城路290号33栋,2,9,正常公开,1:2021:0,2:2022:0,3:2023:0,4::-,5::-
乌鲁木齐星辰汇峰环保科技有限公司,91650102091944073Y,新疆维吾尔自治区-乌鲁木齐市-天山区-新疆乌鲁木齐市天山区光华路中巷3号1栋1单元13室,2,9,正常公开,1:2021:0,2:2022:0,3:2023:0,4::-,5::-
三明市闽环国投环保有限公司,91350400MA344XP66W,福建省-三明市-三元区-新市中路395号三明市电子商务创业培训中心9楼,2,13,正常公开,1:2019:0,2:2020:0,3:2021:0,4:2022:5,5:2023:0
山西德尔雅环保科技有限公司,911401070541605446,山西省-太原市-山西转型综改示范区-长治路258号2层,2,4,正常公开,1:2019:0,2:2020:5,3:2021:0,4:2022:5,5:2023:0
内蒙古君晖环境科技有限公司,91150404MA13U9E33C,内蒙古自治区-赤峰市-松山区-八家组团成龙嘉园小区17号楼5-103厅,2,0,正常公开,1:2021:0,2:2022:0,3:2023:0,4::-,5::-
甘肃启隆环境科技有限公司,91620103MA74XJ0215,甘肃省-兰州市-安宁区-安宁堡街道蓝科路687号中海广场16号楼2318室,2,5,正常公开,1:2022:0,2:2023:0,3::-,4::-,5::-
浙江全度企业管理咨询有限公司,91330301MA2JAWFX5A,浙江省-温州市-经济技术开发区-滨海一道1599号1号楼1210室,2,5,正常公开,1:2020:0,2:2021:0,3:2022:0,4:2023:0,5::-
山东初行环保科技有限公司,91371302MA3M3NLC3N,山东省-临沂市-高新技术产业开发区-罗西街道双月园路科技创业园D728室,2,2,正常公开,1:2022:0,2:2023:0,3::-,4::-,5::-
江门市长绿环保科技有限公司,914407003383556859,广东省-江门市-蓬江区-江门市蓬江区杜阮镇瑶村屋从岭工业区A区1号厂房,2,3,正常公开,1:2022:0,2:2023:0,3::-,4::-,5::-
河南泊中环保科技有限公司,91410102MA44UX5R40,河南省-郑州市-高新技术开发区-科学大道57号中原国家广告产业园3号楼12层212-16室,2,5,正常公开,1:2022:0,2:2023:0,3::-,4::-,5::-
无锡英普特环保科技有限公司,91320282MA1Y0J618P,江苏省-无锡市-惠山区-惠山经济开发区智慧路21号1号楼106室,2,13,正常公开,1:2020:0,2:2021:0,3:2022:0,4:2023:0,5::-
新疆中新环宇科技发展有限公司,91650106MABJJ6U64L,新疆维吾尔自治区-乌鲁木齐市-经济技术开发区-玄武湖路555号乌鲁木齐经开万达广场6栋14栋写字楼办公3615室,2,6,正常公开,1:2021:0,2:2022:0,3:2023:0,4::-,5::-
山西华领生态环境科技股份有限公司,91149900MA0K51PT1B,山西省-太原市-山西转型综改示范区-太原唐槐园区龙盛街恒建公司综合楼2层202室,2,12,正常公开,1:2019:0,2:2020:0,3:2021:0,4:2022:0,5:2023:0
山东山河环境服务有限公司,91370100MA3NNKHA30,山东省-济南市-高新技术产业开发区-中国（山东）自由贸易试验区济南片区新泺大街1299号鑫盛大厦1号楼14层G区域,2,3,正常公开,1:2019:0,2:2020:0,3:2021:0,4:2022:0,5:2023:5
江西蓝河湾环保科技有限公司,91360821MA3AECNR89,江西省-吉安市-吉州区-安宁路38号4幢1-102室,2,3,正常公开,1:2023:0,2::-,3::-,4::-,5::-
上海复旦规划建筑设计研究院有限公司,913101106315691998,上海市-上海市-杨浦区-国泰路127弄复旦科技园2号楼339室,2,3,正常公开,1:2020:0,2:2021:0,3:2022:0,4:2023:0,5::-
上海辛之木环保科技有限公司,91310114MAC1CCBK13,上海市-上海市-嘉定区-云谷路599弄6号620室J,2,3,正常公开,1:2022:0,2:2023:0,3::-,4::-,5::-
贵州汇清环保科技有限公司,91520198MABM4BFJXY,贵州省-贵阳市-观山湖区-长岭街道长岭北路中天会展城B区金融商务区北区（2）1单元18层1号,2,5,正常公开,1:2023:0,2::-,3::-,4::-,5::-
上海莘然环境管理有限公司,91310112MA1GCUPA10,上海市-上海市-闵行区-放鹤路1088号,2,0,正常公开,1:2020:0,2:2021:0,3:2022:8,4:2023:0,5::-
唐山奇源环境科技有限公司,91130293MA0EGDFF0D,河北省-唐山市-路北区-草场街汉斯昆德故居博物馆东侧的房屋A2003号,2,4,正常公开,1:2020:0,2:2021:0,3:2022:0,4:2023:0,5::-
河北工玉环境科技有限公司,91130102MA7LWGHJ0A,河北省-石家庄市-桥西区-裕华西路66号海悦天地C座1109,2,1,正常公开,1:2022:0,2:2023:0,3::-,4::-,5::-
山西环森环保科技有限公司,91140109MA0LUHFW30,山西省-太原市-万柏林区-晋祠路一段8号中海寰宇天下4幢40层4003室,2,4,正常公开,1:2023:0,2:2024:0,3::-,4::-,5::-
深圳市汇泽通环境技术有限公司,91440300358828574A,广东省-深圳市-福田区-深圳市福田区香蜜湖街道东海社区深南大道7008阳光高尔夫大厦1401-1406,2,6,正常公开,1:2019:0,2:2020:0,3:2021:0,4:2022:0,5:2023:0
江苏翠峰生态环境有限公司,91320105MA1Y28MK6T,江苏省-南京市-建邺区-江东中路315号中泰国际广场6幢12层1203-2室,2,3,正常公开,1:2023:0,2::-,3::-,4::-,5::-
浙江潽海环境科技有限公司,91330108MA2AYGGK4W,浙江省-杭州市-西湖区-文三路398号东方通信大厦,2,5,正常公开,1:2019:0,2:2020:0,3:2021:0,4:2022:0,5:2023:0
襄阳鑫襄环环境科技有限公司,91420600MA49KJWK0G,湖北省-襄阳市-襄城区-檀溪路名仕家天下2幢1屋006室,2,6,正常公开,1:2022:0,2:2023:5,3::-,4::-,5::-
内蒙古百瑞兴环保科技有限责任公司,91150105MA7YNC2M1D,内蒙古自治区-呼和浩特市-赛罕区-学苑东街绿地领海大厦A座18楼1808-1813室,2,2,正常公开,1:2023:0,2:2024:0,3::-,4::-,5::-
威海宏湖环保科技有限公司,91371002MAD79PUX56,山东省-威海市-环翠区-环翠楼街道世昌大道3-1号911,2,0,正常公开,1:2023:0,2::-,3::-,4::-,5::-
秀瑞源（上海）环境科技有限公司,91310114MAC7LUC400,上海市-上海市-嘉定区-环城路2222号1幢J,2,2,正常公开,1:2024:0,2::-,3::-,4::-,5::-
湖南建源环保科技有限公司,91430111MAD2BY6R4W,湖南省-长沙市-雨花区-洞井街道湘府东路二段200号华坤大楼1113房,2,5,正常公开,1:2023:0,2::-,3::-,4::-,5::-
河北墨匠节能环保科技有限公司,91130108MA0DTUAM25,河北省-石家庄市-裕华区-河北省石家庄市裕华区南二环20河北师大科技园A座1131室,2,0,正常公开,1:2023:0,2::-,3::-,4::-,5::-
广电计量评价咨询（广东）有限公司,91440112MACXD9GKXN,广东省-广州市-黄埔区-南翔二路31号3栋301房,2,7,正常公开,1:2023:0,2::-,3::-,4::-,5::-
陕西义合环保科技有限公司,91610131MACX4R7Q1H,陕西省-西安市-高新技术产业开发区-科技六路建邦华庭商铺10106,2,1,正常公开,1:2024:0,2::-,3::-,4::-,5::-
甘肃立新绿融科技咨询有限公司,91620100MACX3A6R10,甘肃省-兰州市-城关区-高新南河北路608号18层1818室,2,0,正常公开,1:2024:0,2::-,3::-,4::-,5::-
上海市环境工程设计科学研究院有限公司,91310101783113860M,上海市-上海市-黄浦区-南苏州路381号502-H室,2,0,正常公开,1:2023:0,2::-,3::-,4::-,5::-
河南豫华环保技术有限公司,91410100MA9LYHRY4J,河南省-郑州市-郑州航空港经济综合实验区-郑州市航空港区新港大道锦荣信息科技园15号楼6楼,2,2,正常公开,1:2023:0,2::-,3::-,4::-,5::-
山东开圆工程咨询管理有限公司,91371700MA3UDPTJ9D,山东省-菏泽市-牡丹区-中华路佳和城A栋19楼,1,4,正常公开,1:2021:0,2:2022:0,3:2023:5,4:2024:0,5::-
德州双蓝环保科技有限公司,91371400MA3RPAGH1M,山东省-德州市-德城区-广川街道办事处三八中路279号德州唐人中心C区SOHO22层11号,1,4,正常公开,1:2022:0,2:2023:0,3::-,4::-,5::-
贵州石合天环保工程设计有限公司,91520303MA6E5N9G9R,贵州省-遵义市-汇川区-珠海路万豪国际A2栋五楼平台,1,7,正常公开,1:2019:0,2:2020:5,3:2021:7,4:2022:5,5:2023:0
广东清博环保技术有限公司,91441302MA557HGH6N,广东省-惠州市-惠城区-新岸路1号世贸中心17层F房02室,1,5,正常公开,1:2020:0,2:2021:0,3:2022:0,4:2023:0,5::-
四川禹承环境治理有限公司,91511600MA65JR6B80,四川省-广安市-广安区-朝阳大道一段347号,1,0,正常公开,1:2019:0,2:2020:5,3:2021:0,4:2022:5,5:2023:5
常州嘉骏环保服务有限公司,91320412MA1MC38A5A,江苏省-常州市-武进区-湖塘镇东升路31号,1,6,正常公开,1:2019:0,2:2020:0,3:2021:5,4:2022:0,5:2023:0
安徽伟越环境科技有限公司,91340104MA2RH8LU9X,安徽省-合肥市-蜀山区-合肥市蜀山区金寨路与潜山路交口金潜广场1205室,1,4,守信名单,1:2021:0,2:2022:0,3:2023:0,4::-,5::-
云南智捷环保科技有限公司,91532621316325557J,云南省-文山壮族苗族自治州-文山市-开化街道西山社区螺峰路壮华苑11-12号1-2层,1,15,正常公开,1:2019:0,2:2020:0,3:2021:0,4:2022:0,5:2023:0
佛山市瑞龙拓达环保科技有限公司,91440605MA4WB7GX47,广东省-佛山市-南海区-桂城佛平新路紫金城2号楼H247号铺,1,5,正常公开,1:2020:0,2:2021:0,3:2022:0,4:2023:0,5:2023:0
合肥冉启环境科技有限公司,91340111MA8P4D0W3E,安徽省-合肥市-包河区-延安路28号4＃厂房2楼,1,3,正常公开,1:2022:0,2:2023:5,3::-,4::-,5::-
青海安环技术咨询有限公司,91630102399953187X,青海省-西宁市-城东区-青海省西宁市城东区建国大街57号D区2号楼1193室,1,6,正常公开,1:2020:0,2:2021:3,3:2022:5,4:2023:0,5::-
湖南睿鼎建设服务有限公司,9143020432566012XK,湖南省-株洲市-天元区-湖南省株洲市天元区马家河街道金马路1号中南高科株洲智创广场14号厂房104-8号房,1,3,正常公开,1:2020:0,2:2021:0,3:2022:0,4:2023:0,5::-
长兴绿能工程咨询有限公司,91330522329964446P,浙江省-湖州市-长兴县-浙江省湖州市长兴县太湖街道格兰国际广场2704C-2,1,8,正常公开,1:2019:0,2:2020:0,3:2021:0,4:2022:0,5:2023:0
内蒙古纳恒环境科技有限公司,91150102MA0Q0T86XB,内蒙古自治区-呼和浩特市-新城区-爱民街东段一家村社区综合楼A座四层408室,1,5,正常公开,1:2020:0,2:2021:0,3:2022:0,4:2023:0,5::-
河北霖萱工程管理咨询有限公司,91130501MA0E6BQE21,河北省-邢台市-开发区-中兴东大街1889号河北工业大学科技园1号楼711室,1,1,正常公开,1:2019:0,2:2020:0,3:2021:0,4:2022:0,5:2023:5
河南九域恩湃电力技术有限公司,914101007296168117,河南省-郑州市-二七区-嵩山南路9号14号楼1单元附13号,1,10,正常公开,1:2019:0,2:2020:0,3:2021:0,4:2022:0,5:2023:0
云南绿蓝环境科技有限公司,91530122MA6NE9UK4A,云南省-昆明市-晋宁县-昆阳街道东凤路98号,1,13,正常公开,1:2019:0,2:2020:0,3:2021:0,4:2022:0,5:2023:0
青海聚黔生态环保科技有限公司,91630104MABJD8B15A,青海省-西宁市-城西区-五四西路53号1号楼2单元2131号,1,3,正常公开,1:2021:0,2:2022:5,3:2023:12,4::-,5::-
四川新云蓝天环保科技有限公司,91510903MA67LTHY40,四川省-遂宁市-船山区-介福东路150号,1,3,正常公开,1:2020:0,2:2021:0,3:2022:0,4:2023:5,5::-
湖南航桂环保科技有限公司,91431003MA4QT63795,湖南省-郴州市-苏仙区-王仙岭街道郴州大道15号,1,6,正常公开,1:2019:0,2:2020:0,3:2021:5,4:2022:5,5:2023:0
昆明飞驰环保科技有限公司,91530102555142272E,云南省-昆明市-五华区-普吉路137号,1,2,正常公开,1:2019:0,2:2020:0,3:2021:0,4:2022:0,5:2023:0
内蒙古蓝际环保技术有限公司,911501055554714124,内蒙古自治区-呼和浩特市-赛罕区-巨海城八区1号楼东701号,1,5,正常公开,1:2019:0,2:2020:0,3:2021:5,4:2022:5,5:2023:0
烟台福聚环保科技有限公司,91370614MAC7X64C5T,山东省-烟台市-芝罘区-白石路100号,1,1,正常公开,1:2023:0,2:2024:0,3::-,4::-,5::-
江西腾茂工程咨询有限公司,91360703MA3ACY130X,江西省-赣州市-赣州经济技术开发区-金凤西路南、金潭大道东侧赣州力昌表业有限公司办公楼二楼201室,1,2,正常公开,1:2021:0,2:2022:0,3:2023:3,4::-,5::-
黑河市铭润达环保监测有限公司,91231100MA1BFQYWX7,黑龙江省-黑河市-边境经济合作区-黑河市合作区大黑河岛国贸城三楼南侧303室（自贸区）,1,0,正常公开,1:2020:0,2:2021:5,3:2022:5,4:2023:0,5::-
陕西联聚科技集团有限公司,91610702MA6YUWKP1Q,陕西省-汉中市-南郑县-大河坎镇南郑大道东段盛世华庭15幢二层,1,4,正常公开,1:2020:0,2:2021:0,3:2022:5,4:2023:0,5::-
广西宸景环保技术有限公司,91450600MA5MUXWP8C,广西壮族自治区-防城港市-港口区-西湾广场北侧阳光海岸碧海新天7号楼15层1512号房,1,3,正常公开,1:2020:0,2:2021:0,3:2022:0,4:2023:0,5::-
河南汇能阜力科技有限公司,914101057891503984,河南省-郑州市-中国（河南）自由贸易试验区郑州片区-榆林北路37号龙宇国际8层816号,1,7,正常公开,1:2019:0,2:2020:10,3:2021:5,4:2022:0,5:2023:0
山东山明环境服务有限公司,91370983MA3C24ARXP,山东省-泰安市-肥城市-新城路002号,1,1,正常公开,1:2019:0,2:2020:5,3:2021:0,4:2022:0,5:2023:0
湖北苇杭环保科技有限公司,91421100MA487U6A1H,湖北省-武汉市-东湖新技术开发区-高新四路40号葛洲坝太阳城5栋5层02室02号（一址多照）,1,5,正常公开,1:2019:0,2:2020:0,3:2021:5,4:2022:0,5:2023:0
云南七彩环境咨询有限公司,91530300697999159P,云南省-曲靖市-麒麟区-曲靖市麒麟区古城巷中段（宝林美食烧烤城）,1,2,正常公开,1:2019:0,2:2020:0,3:2021:0,4:2022:0,5:2023:0
苏州同睦项目管理有限公司,91320581MA1NT0UA03,江苏省-苏州市-常熟市-开元东路1号,1,4,正常公开,1:2019:0,2:2020:2,3:2021:0,4:2022:0,5:2023:0
南通百通环境科技有限公司,91320611MA1R8N9A9W,江苏省-南通市-崇川区-姚港路52号江景苑A幢1006室,1,4,守信名单,1:2020:0,2:2021:0,3:2022:0,4:2023:0,5::-
河南洁呈工程咨询有限公司,91411303MA40EJL30Q,河南省-南阳市-宛城区-溧河乡涧河路6号,1,0,正常公开,1:2022:0,2:2023:0,3:2024:0,4::-,5::-
重庆延峰环境科技有限公司,91500107MAAC2RB94P,重庆市-重庆市-九龙坡区-西彭镇森迪大道10号3幢,1,2,正常公开,1:2022:0,2:2023:0,3::-,4::-,5::-
西安阔卓环境技术有限公司,91610113MAB0WYH53P,陕西省-西咸新区-沣东新城-三桥街道华润万象城D座,1,4,正常公开,1:2022:0,2:2023:0,3::-,4::-,5::-
遵义蓝天环保科技有限公司,9152032234707579XK,贵州省-遵义市-桐梓县-娄山关街道鞍山村庞家湾组7号,1,3,正常公开,1:2020:0,2:2021:2,3:2022:0,4:2023:10,5::-
广东汇恒环保科技发展有限公司,91441802MA53YTRM5J,广东省-清远市-清城区-小市凤翔大道5号东方巴黎一号楼25层26号,1,4,正常公开,1:2019:0,2:2020:0,3:2021:0,4:2022:0,5:2023:0
成都寂懿环境工程有限公司,915101063505235228,四川省-成都市-金牛区-银河北街231号,1,3,正常公开,1:2019:0,2:2020:0,3:2021:0,4:2022:0,5:2023:0
阿克苏律天环保工程有限公司,9165290106881465XE,新疆维吾尔自治区-阿克苏地区-阿克苏市-阿克苏市晶水路丽园五区2号楼5单元101,1,6,正常公开,1:2020:0,2:2021:0,3:2022:5,4:2023:10,5::-
河南星烁科技有限公司,91410105MA45FWQ11K,河南省-郑州市-金水区-黄河建工大厦B座512室,1,5,正常公开,1:2019:0,2:2020:0,3:2021:0,4:2022:0,5:2023:0
湖北务实环境科技有限公司,91420200MA7LMQRCX7,湖北省-黄石市-下陆区-团城山街道杭州西路176-1号,1,0,正常公开,1:2022:0,2:2023:0,3::-,4::-,5::-
湖北远昇生态环境技术有限公司,914205003165499059,湖北省-宜昌市-高新经济技术开发区-发展大道57-5号5026号,1,5,正常公开,1:2019:0,2:2020:0,3:2021:0,4:2022:0,5:2023:0
临沧正诚环境技术有限公司,91530902MA6NQ5J13C,云南省-临沧市-临翔区-扎路营小区七栋一单元,1,2,正常公开,1:2019:0,2:2020:0,3:2021:0,4:2022:0,5:2023:0
聊城市深科节能环保科技有限公司,91371502MA3MQ8RE2R,山东省-聊城市-经济技术开发区-黄山路育新印刷厂办公楼3028室,1,2,正常公开,1:2022:0,2:2023:0,3::-,4::-,5::-
山东普蓝环境技术服务有限公司,91370281MA3TD35F2E,山东省-青岛市-胶州市-九龙街道办事处周家村,1,4,正常公开,1:2021:0,2:2022:0,3:2023:5,4::-,5::-
内蒙古绿川环境科技有限公司,91150102MA13N0TH0H,内蒙古自治区-呼和浩特市-新城区-成吉思汗大街绿地新都会C22号楼1单元602,1,6,正常公开,1:2021:0,2:2022:0,3:2023:0,4::-,5::-
