青岛海西环保科技有限公司,91370211682596189M,山东省-青岛市-黄岛区-王台镇安康路1167号9栋工业一层,1,4,正常公开,1:2019:0,2:2020:13,3:2021:0,4:2022:0,5:2023:0
江苏原木环境科技有限公司,91321003MA1MHY0E9X,江苏省-扬州市-邗江区-文昌西路440号国泰大厦1号楼601、602、603、612,1,13,守信名单,1:2019:0,2:2020:0,3:2021:0,4:2022:0,5:2023:0
江门绿金环保科技有限公司,91440703MA53JXGUXM,广东省-江门市-蓬江区-篁庄大道西10号6幢801室3-819室,1,2,正常公开,1:2019:0,2:2020:0,3:2021:0,4:2022:0,5:2023:0
南宁市新本环保技术有限公司,91450103699884566N,广西壮族自治区-南宁市-青秀区-植物路50号广西气象局生活小区内办公楼315、316号,1,3,正常公开,1:2020:0,2:2021:0,3:2022:0,4:2023:0,5::-
湖南霖昇工程技术咨询有限公司,91430100MA4QMM7K62,湖南省-长沙市-国家高新技术产业开发区-麓景路2号科技信息及IT楼二楼X214房,1,7,正常公开,1:2020:0,2:2021:5,3:2022:0,4:2023:5,5::-
佛山市弘博立环保科技有限公司,91440605MA4WH73F7N,广东省-佛山市-南海区-桂城街道南平西路广东夏西国际橡塑城二期2＃商铺（凯泰中心）901单元,1,1,正常公开,1:2020:0,2:2021:0,3:2022:5,4:2023:0,5::-
南宁环彩环保有限公司,91450102MA5KB71N85,广西壮族自治区-南宁市-兴宁区-昆仑大道大嘉汇财富中心20212022,1,3,正常公开,1:2020:0,2:2021:5,3:2022:0,4:2023:0,5::-
北京绿方舟科技有限责任公司,91110101772587956L,北京市-北京市-朝阳区-化工路59号院1号楼1至14层01内B座二层220室,1,1,正常公开,1:2019:0,2:2020:0,3:2021:0,4:2022:0,5:2023:0
内蒙古格林普尔环境技术咨询有限公司,91150404MA0QQ4BH2B,内蒙古自治区-赤峰市-松山区-新天地商务广场7-11-2-020724,1,2,正常公开,1:2020:0,2:2021:0,3:2022:0,4:2023:0,5::-
靖边县友安实业有限公司,91610824MA70BA5D57,陕西省-榆林市-靖边县-民生路生财巷195号,1,2,正常公开,1:2021:0,2:2022:0,3:2023:5,4::-,5::-
河南青城环保科技有限公司,91410900MA46WENGXH,河南省-濮阳市-经济技术开发区-中原路与卫河路交叉口往北100米路西茂源景城3号楼2单元102室,1,5,正常公开,1:2021:3,2:2022:0,3:2023:5,4:2024:0,5::-
秦皇岛正云环保工程有限公司,91130301MA09BARB42,河北省-秦皇岛市-经济技术开发区-峨眉山北路5号华博工贸三楼,1,9,正常公开,1:2019:0,2:2020:0,3:2021:0,4:2022:0,5:2023:5
山西绿洲阳光环保科技有限公司,911401063170174093,山西省-太原市-迎泽区-柳巷南路28号第2幢1单元1909号房,1,9,正常公开,1:2020:0,2:2021:0,3:2022:5,4:2023:0,5::-
四川世安翊环保科技有限公司,91510105MA634EGB27,四川省-成都市-青羊区-清江东路134号1栋1单元2楼219号,1,8,正常公开,1:2020:0,2:2021:0,3:2022:0,4:2023:5,5::-
河北浩达环保技术服务有限公司,91130606576770622B,河北省-保定市-高新技术产业开发区-恒源西路888号3S双创社区中试车间B2座3层01室,1,4,正常公开,1:2019:0,2:2020:0,3:2021:0,4:2022:0,5:2023:0
江苏绿艾普安全环保科技有限公司,91320925MA20E020XN,江苏省-盐城市-建湖县-东方御花园D幢113室,1,7,守信名单,1:2019:0,2:2020:0,3:2021:0,4:2022:0,5:2023:0
邢台蓝腾环境咨询有限公司,91130502MA0DGK3C8D,河北省-邢台市-开发区-江东八路118号爱特园4＃楼2层202A室,1,5,正常公开,1:2019:0,2:2020:5,3:2021:0,4:2022:0,5:2023:0
长沙川海环保科技有限公司,91430181MA4QX1GY0M,湖南省-长沙市-浏阳市-关口街道长兴社区行政中心东紫门10栋603,1,1,正常公开,1:2019:0,2:2020:0,3:2021:0,4:2022:5,5:2023:5
重庆雅城环保科技有限公司,91500112MA60BN9K1W,重庆市-重庆市-渝北区-人和街道新南路162号B单元2915号,1,7,正常公开,1:2020:0,2:2021:0,3:2022:0,4:2023:5,5::-
河南金浪桥工程管理有限公司,91411403MA9G215N10,河南省-商丘市-睢阳区-府前路与神火大道交叉口向南200米路东府前花园B栋三楼,1,2,正常公开,1:2022:0,2:2023:0,3::-,4::-,5::-
黑龙江盛为科技有限公司,91230103MA1BQRF50C,黑龙江省-哈尔滨市-南岗区-黑龙江省哈尔滨市南岗区学府路68号黑大科技园3层写字间315室,1,2,正常公开,1:2021:0,2:2022:0,3:2023:0,4::-,5::-
湖南美景环保科技咨询服务有限公司,9143011168741660X7,湖南省-长沙市-雨花区-芙蓉中路二段359号佳天大厦南栋32E房,1,6,正常公开,1:2019:0,2:2020:10,3:2021:0,4:2022:0,5:2023:0
南通鑫睿环境安全科技服务有限公司,91320684MA1WLUJ05R,江苏省-南通市-海门市-海门街道鸥江南路89号内5号房,1,5,正常公开,1:2020:0,2:2021:5,3:2022:0,4:2023:0,5::-
新疆朗新天环保科技有限公司,91650102MA775DA454,新疆维吾尔自治区-乌鲁木齐市-天山区-中山路国际合信大厦428室,1,4,正常公开,1:2019:0,2:2020:0,3:2021:0,4:2022:0,5:2023:0
山西绿清环境工程有限公司,91140105MA0KPWFQ7C,山西省-太原市-万柏林区-南内环西街欢乐颂公寓南塔1511,1,4,正常公开,1:2019:0,2:2020:0,3:2021:5,4:2022:0,5:2023:0
甘肃拓承环境工程有限公司,91620702MA72HDN14L,甘肃省-张掖市-甘州区-康乐路76号奇正嘉苑楼下商铺,1,4,正常公开,1:2020:0,2:2021:0,3:2022:0,4:2023:0,5::-
合肥长鸿环保工程有限公司,91340104MA2TRKQN2R,安徽省-合肥市-市辖区-合欢路与西二环交叉口亿诺商务中心1308室,1,3,正常公开,1:2020:0,2:2021:5,3:2022:0,4:2023:0,5::-
陕西绿辉环境科技有限公司,91610132333652357U,陕西省-咸阳市-秦都区-世纪大道帝都花园21号楼,1,6,正常公开,1:2019:0,2:2020:0,3:2021:0,4:2022:0,5:2023:0
广西光信咨询集团有限公司,91450107MA5N5P1337,广西壮族自治区-南宁市-西乡塘区-高新大道55号南宁安吉万达广场2栋1801号,1,6,正常公开,1:2020:0,2:2021:0,3:2022:5,4:2023:0,5:2024:0
宜春政大环保科技有限公司,91360921MA7H9CUE21,江西省-宜春市-奉新县-冯川镇潦河东路277号融汇山水大酒店5号楼801室,1,3,正常公开,1:2022:0,2:2023:5,3::-,4::-,5::-
沈阳联鑫环保科技有限公司,91210104MA0YAFY18J,辽宁省-沈阳市-大东区-津桥路6号2门,1,8,正常公开,1:2020:0,2:2021:0,3:2022:0,4:2023:0,5::-
浙江万银节能环保科技有限公司,91330604MA2885GK0H,浙江省-绍兴市-上虞区-百官街道锦瑞大厦1407,1,4,正常公开,1:2021:0,2:2022:0,3:2023:5,4::-,5::-
广州市绿轩环保科技有限公司,91440101MA9YAH2162,广东省-广州市-增城区-荔城街增城大道69号4幢1520号,1,0,正常公开,1:2022:0,2:2023:0,3::-,4::-,5::-
赣州市奥因环保科技有限公司,91360702MA35JPYR6C,江西省-赣州市-章贡区-章江新区阳明国际中心3幢19-19＃办公,1,4,正常公开,1:2021:0,2:2022:5,3:2023:0,4::-,5::-
郑州洁神环境保护信息咨询有限公司,91410105572474084M,河南省-郑州市-郑州东区-博学路277号正商学府广场A座2001号,1,1,正常公开,1:2020:0,2:2021:0,3:2022:0,4:2023:0,5::-
厦门高净环保技术有限公司,91350206MA345QTU4D,福建省-厦门市-思明区-吕岭路1790号801室之二,1,5,正常公开,1:2020:0,2:2021:0,3:2022:0,4:2023:0,5::-
安徽友泓环境工程技术有限公司,91340102MA2UE4697R,安徽省-合肥市-瑶海区-安徽省合肥市瑶海区临泉东路227号瑶海万达广场3幢写字楼3-办1305,1,5,正常公开,1:2019:0,2:2020:0,3:2021:0,4:2022:5,5:2023:0
阳江市蓝依宝环保工程有限公司,91441702304238667B,广东省-阳江市-阳东区-东城镇升平路91号二楼,1,4,正常公开,1:2020:0,2:2021:0,3:2022:0,4:2023:0,5::-
山东省波尔辐射环境技术有限公司,91370104747817115U,山东省-济南市-历城区-贞元街1277好鲁坤天鸿创谷中心1-1号楼,1,0,正常公开,1:2019:0,2:2020:0,3:2021:0,4:2022:0,5:2023:0
黑龙江易安环科技发展有限公司,91230109MA1BE8NR4K,黑龙江省-哈尔滨市-道里区-道里区工部街35-1号4单元201室,1,1,正常公开,1:2022:0,2:2023:5,3::-,4::-,5::-
枣庄珵美项目管理有限公司,91370481MA3N5XHB92,山东省-枣庄市-滕州市-龙泉街道北辛东路奥体花园6-908室,1,3,正常公开,1:2021:0,2:2022:8,3:2023:0,4::-,5::-
甘肃昊田环保科技有限公司,91620102MA72QTU11W,甘肃省-兰州市-城关区-高新雁东路102号17层B06室,1,4,正常公开,1:2019:0,2:2020:0,3:2021:0,4:2022:0,5:2023:0
广州达盛检测技术服务有限公司,91440106583385554E,广东省-广州市-天河区-中山大道中1015号3A11,1,6,正常公开,1:2020:0,2:2021:0,3:2022:0,4:2023:0,5::-
桂林启誉环保科技有限公司,91450300MA5PBEPY48,广西壮族自治区-桂林市-七星区-环城南一路14号新进广场11栋1-7-11号,1,6,正常公开,1:2020:0,2:2021:0,3:2022:0,4:2023:0,5::-
安徽创杰环境科技有限公司,91340500MA2RQQKM5A,安徽省-马鞍山市-雨山区-九华西路1369号30栋3层,1,5,守信名单,1:2019:0,2:2020:0,3:2021:0,4:2022:0,5:2023:0
湖南汇美环保发展有限公司,91430111MA4L39GQ95,湖南省-长沙市-雨花区-长沙大道605号盛世华章小区A7栋1902,1,6,正常公开,1:2019:0,2:2020:0,3:2021:0,4:2022:0,5:2023:0
福建省谦迈环保科技有限公司,91350802MA8UPJYQ6N,福建省-龙岩市-新罗区-西陂街道华莲社区天平路35号L幢6层605室,1,0,正常公开,1:2022:0,2:2023:5,3::-,4::-,5::-
江西汕和环保工程有限公司,91360103MA3864YU5C,江西省-南昌市-红谷滩新区-红谷中大道348号海航白金花园1栋2单元101室,1,2,正常公开,1:2020:0,2:2021:0,3:2022:0,4:2023:0,5::-
四川拾光者环境技术有限公司,91510100MA6CEY8W05,四川省-成都市-天府新区-华阳街道华阳大道三段67号,1,5,正常公开,1:2019:0,2:2020:0,3:2021:0,4:2022:0,5:2023:0
济南稷德环保工程有限公司,91370112084030564M,山东省-济南市-历下区-经十东路3302号综合办公楼501室,1,2,正常公开,1:2020:0,2:2021:0,3:2022:5,4:2023:0,5:2024:0
南京昊晟环保科技有限公司,91320105MA1W9MQ96G,江苏省-南京市-玄武区-玄武大道699-10号,1,4,正常公开,1:2019:0,2:2020:5,3:2021:0,4:2022:0,5:2023:0
哈尔滨绿宸环保科技有限公司,91230109MA19C0F91K,黑龙江省-哈尔滨市-香坊区-和兴路19号,1,0,正常公开,1:2019:0,2:2020:0,3:2021:0,4:2022:0,5:2023:0
广东东正绿能环保科技有限公司,91441900MA513H1U15,东城街道银贵路6号2栋810室,1,3,正常公开,1:2019:0,2:2020:0,3:2021:8,4:2022:0,5:2023:0
山东博航生态环境有限公司,91371300MA3WK9Q35D,山东省-临沂市-高新技术产业开发区-双月园路276号龙湖软件园C310，C311,1,5,正常公开,1:2021:0,2:2022:0,3:2023:4,4::-,5::-
辽宁喜尔技术咨询服务有限公司,91210600MA10E84W4K,辽宁省-丹东市-高新区-育成中心1号楼6009,1,5,正常公开,1:2020:0,2:2021:0,3:2022:0,4:2023:0,5::-
山东汉华环保工程有限公司,91371102MA3DTNCT9D,山东省-日照市-经济技术开发区-北京路街道天津路61号5F,1,1,正常公开,1:2022:0,2:2023:0,3:2024:0,4::-,5::-
内蒙古新仕界项目管理有限公司,91150602MA7FCL9U98,内蒙古自治区-鄂尔多斯市-东胜区-沙日乌素路9号峰上峰商务综合楼1号楼16层1619,1,2,正常公开,1:2022:0,2:2023:0,3::-,4::-,5::-
江苏炟凯环境技术有限公司,91320411MA1W67M186,江苏省-常州市-新北区-荣盛锦绣华府3幢710室,1,3,正常公开,1:2019:0,2:2020:0,3:2021:0,4:2022:5,5:2023:0
江西净莲环保技术有限公司,91360121MA39UHU280,江西省-南昌市-南昌县-莲塘镇迎宾中大道2013号盛汇城市广场住宅区3栋1单元2307室,1,4,正常公开,1:2021:0,2:2022:0,3:2023:0,4::-,5::-
山东扬清环保科技有限公司,91370202MA7JRW4T4J,山东省-青岛市-市南区-南京路12号3号楼903户,1,3,正常公开,1:2022:0,2:2023:0,3::-,4::-,5::-
广西中赛工程咨询有限公司,914502050790752745,广西壮族自治区-南宁市-青秀区-东葛路165号绿地中央广场C1栋22楼2217室,1,6,正常公开,1:2021:0,2:2022:0,3:2023:0,4::-,5::-
辽宁昊华生态环境科技有限公司,91211403MA0XXYLX3H,辽宁省-葫芦岛市-龙港区-龙湾大街54号楼3单元1402室,1,2,正常公开,1:2019:0,2:2020:0,3:2021:0,4:2022:0,5:2023:0
中测智评环保科技（武汉）有限公司,91420100MA49F75A72,湖北省-武汉市-东湖新技术开发区-光谷大道77号金融港后台服务中心一期A5幢23层20号(自贸区武汉片区),1,6,正常公开,1:2020:0,2:2021:0,3:2022:5,4:2023:0,5::-
新余杰瑞环保技术有限公司,91360502MA3AF2Q39G,江西省-新余市-渝水区-城北体育馆路328号帝海观澜23栋108铺,1,3,正常公开,1:2021:0,2:2022:5,3:2023:0,4::-,5::-
南通恒源环境技术有限公司,91320623067637284A,江苏省-南通市-如东县-城中街道长江路399号浦发领秀城68号楼2楼东,1,5,守信名单,1:2020:0,2:2021:0,3:2022:0,4:2023:0,5::-
四川凯均环保工程有限公司,91510502MAACKDAD07,四川省-泸州市-江阳区-一环路酒城大道三段16号1号楼1103号,1,6,正常公开,1:2022:0,2:2023:0,3::-,4::-,5::-
军科四合环境科技(黑龙江)有限公司,91230102078055001D,黑龙江省-哈尔滨市-道里区-上海街9号508室,1,0,正常公开,1:2020:0,2:2021:0,3:2022:0,4:2023:0,5::-
河北启今环境科技有限公司,91130108MA0EFUWFX6,河北省-石家庄市-裕华区-槐安路158号鑫科国际C座1202室,1,0,正常公开,1:2020:0,2:2021:0,3:2022:0,4:2023:5,5::-
重庆晨之光环保科技有限公司,91500105MA60E4YH00,重庆市-重庆市-渝北区-龙山街道橄榄郡9幢-2-8-5,1,5,正常公开,1:2019:0,2:2020:5,3:2021:2,4:2022:8,5:2023:0
甘肃海纳环保技术服务有限公司,91621002MA74J3MF8N,甘肃省-庆阳市-西峰区-甘肃省庆阳市西峰区东方丽景茂B栋1201室,1,3,正常公开,1:2022:0,2:2023:0,3::-,4::-,5::-
河北广维环安工程项目管理有限公司,91130100MA090F9DXW,河北省-石家庄市-桥西区-维明南大街中华城2408,1,3,正常公开,1:2020:0,2:2021:0,3:2022:0,4:2023:0,5::-
河南裕禄环保科技有限公司,91410200MA3XBJAG9R,河南省-开封市-城乡一体化示范区-三大街新龙御都国际18号楼1单元11层1102室,1,4,正常公开,1:2019:0,2:2020:0,3:2021:0,4:2022:0,5:2023:0
苏州瑞赛泽环境设计工程有限公司,91320505MA23FF0C4J,江苏省-苏州市-虎丘区-苏州高新区长江路465号青成大厦8216室,1,2,正常公开,1:2021:0,2:2022:0,3:2023:0,4:2024:0,5::-
四川舜天环保科技咨询有限公司,91513400MA63QE3Y8T,四川省-凉山彝族自治州-西昌市-月海路二段13号鑫海国际19栋4层404号,1,3,正常公开,1:2019:0,2:2020:0,3:2021:0,4:2022:0,5:2023:0
新疆中科同创环境科技有限公司,91650100MA77ALF2X5,新疆维吾尔自治区-乌鲁木齐市-新市区-北京南路558号康普百信钻石苑F栋京华佳座903－1室,1,2,正常公开,1:2020:0,2:2021:5,3:2022:0,4:2023:0,5::-
江门市蓝盾环保科技有限公司,91440783MA52WJMA6G,广东省-江门市-开平市-长沙街幕村村委会永光新村3-85号房屋,1,4,守信名单,1:2019:0,2:2020:0,3:2021:0,4:2022:0,5:2023:0
清远市亿森源环保科技有限公司,91441803MA4UPTYL5X,广东省-清远市-清城区-新城东五号区北江二路怡景湾大厦首层08号,1,3,正常公开,1:2020:0,2:2021:0,3:2022:0,4:2023:0,5::-
南通绿然环保科技有限公司,91320602MA1P0FEB1T,江苏省-南通市-崇川区-静海街2幢09、10室,1,9,守信名单,1:2019:0,2:2020:0,3:2021:0,4:2022:0,5:2023:0
山西艾蒙普特环保科技有限公司,91140802MA0KJ8CN5L,山西省-运城市-盐湖区-槐东北路688号商铺,1,3,正常公开,1:2019:0,2:2020:0,3:2021:5,4:2022:5,5:2023:0
厦门森意顺环保科技有限公司,91350203MA32JPT782,福建省-厦门市-同安区-火炬高新区（翔安）产业区同龙二路581号605室,1,4,正常公开,1:2020:5,2:2021:0,3:2022:5,4:2023:0,5::-
云南恒成工程设计咨询有限公司,91530103MA6NY2122P,云南省-昆明市-盘龙区-金辰街道碧桂湾小区二期17栋1702号,1,5,正常公开,1:2019:0,2:2020:0,3:2021:0,4:2022:0,5:2023:0
长春市宏元环保科技咨询有限公司,91220101MA147D7A2W,吉林省-长春市-南关区-亚泰大街以东司法警官公寓第A-1幢1003号房,1,0,正常公开,1:2019:0,2:2020:0,3:2021:0,4:2022:0,5:2023:0
江西众城环保科技有限公司,91360406MA3AE2U12N,江西省-九江市-九江市经济技术开发区-长城路121号恒盛科技园21号楼302室,1,5,正常公开,1:2021:0,2:2022:0,3:2023:0,4::-,5::-
厦门昱润环保科技有限公司,91350211303038866G,福建省-厦门市-集美区-门市集美区孙坂南路60号五楼之一,1,6,正常公开,1:2019:0,2:2020:0,3:2021:0,4:2022:0,5:2023:0
安阳鑫峰环境保护咨询有限公司,91410502MA44G03B44,河南省-安阳市-文峰区-文明大道东段路北银鹭花园二期17幢1单元301号,1,3,正常公开,1:2019:0,2:2020:0,3:2021:5,4:2022:0,5:2023:0
浙江泽越环保科技有限公司,91330212MA2AHL3C7B,浙江省-宁波市-镇海区-骆驼街道福业街55号8-1-801室,1,7,正常公开,1:2021:0,2:2022:5,3:2023:0,4::-,5::-
绿益粤（广东）环境科技有限公司,91440704MA5772FE6U,广东省-江门市-江海区-金瓯路233号7栋3单位301室（自编302室）,1,5,正常公开,1:2021:0,2:2022:5,3:2023:0,4::-,5::-
广州中运环保科技有限公司,91440101MA5D1T9D6W,广东省-广州市-天河区-五山路371-1号主楼28楼A104号,1,0,正常公开,1:2019:0,2:2020:0,3:2021:0,4:2022:0,5:2023:0
重庆锦运环保工程有限公司,91500235331678625P,重庆市-重庆市-云阳县-望江大道962号,1,1,正常公开,1:2020:0,2:2021:0,3:2022:0,4:2023:10,5::-
常州武环环保咨询服务有限公司,91320412MA1YA0Y352,江苏省-常州市-武进区-常武中路18-55号美淼大厦1301室（常州科教城内）,1,3,正常公开,1:2019:0,2:2020:5,3:2021:0,4:2022:0,5:2023:0
苏州欣平环境科技有限公司,91320505MA26T3EA33,江苏省-苏州市-高新技术产业开发区-鹿山路25号6幢418B-73室,1,3,正常公开,1:2021:0,2:2022:0,3:2023:0,4::-,5::-
成都绿岛企业管理有限公司,91510113MA6C8Y566C,四川省-成都市-青白江区-同济大道80号,1,12,正常公开,1:2020:3,2:2021:0,3:2022:0,4:2023:0,5::-
河南文汇环保科技有限公司,91410300MA44WU290Q,河南省-洛阳市-中国（河南）自由贸易试验区洛阳片区-高新河洛路215号瑞泽大厦1106-D,1,2,正常公开,1:2019:0,2:2020:0,3:2021:0,4:2022:0,5:2023:0
内蒙古祥砳环保科技咨询有限公司,91150203MA13QG1Y1T,内蒙古自治区-包头市-稀土高新区-黄河大街86号时代广场B座1317,1,9,正常公开,1:2021:0,2:2022:0,3:2023:0,4::-,5::-
四川创新发环境科技有限责任公司,91510600MA66M59B4H,四川省-德阳市-旌阳区-工业集中发展区韶山路与九龙江路交汇处,1,4,正常公开,1:2019:0,2:2020:0,3:2021:0,4:2022:0,5:2023:0
山东嘉宜环安项目管理有限公司,91370100MA3MN8W625,山东省-济南市-历城区-恒大城K栋2501,1,5,正常公开,1:2019:0,2:2020:10,3:2021:0,4:2022:0,5:2023:0
莱州启诚环保技术咨询服务有限公司,91370683MA3C6MLH9L,山东省-烟台市-莱州市-城港路街道开元路1938号,1,3,正常公开,1:2021:0,2:2022:0,3:2023:0,4::-,5::-
甘肃绿能美洁环境管理咨询有限责任公司,91620702MA74XK2U6H,甘肃省-张掖市-甘州区-屋兰路滨河明源小区南门C9-2商铺,1,4,正常公开,1:2020:0,2:2021:5,3:2022:0,4:2023:5,5::-
成都正检科技有限公司,915101080806116796,四川省-成都市-成华区-东三环路二段龙潭总部经济城成宏路68号2幢1单元18层AB号,1,9,正常公开,1:2019:0,2:2020:10,3:2021:8,4:2022:0,5:2023:0
天津绿颖环保科技有限公司,91120223MA06QQTL1C,天津市-天津市-静海区-经济开发区北区十亿道8号,1,2,正常公开,1:2021:0,2:2022:0,3:2023:0,4::-,5::-
河北众蓝环境科技有限公司,91130124MA0EEFFA4G,河北省-石家庄市-桥西区-胜利南街118号塔坛国际商贸城4号写字楼1906室,1,2,守信名单,1:2019:0,2:2020:0,3:2021:0,4:2022:0,5:2023:0
河北宇奥环境工程有限公司,91130105MA0A3Y7T79,河北省-石家庄市-新华区-明珠街红星国际1-2-3001,1,2,正常公开,1:2022:0,2:2023:0,3::-,4::-,5::-
贵州兴源环保有限公司,91520102MA6J3KT43P,贵州省-贵阳市-南明区-花果园兰花广场1栋3404,1,8,正常公开,1:2022:0,2:2023:0,3::-,4::-,5::-
云南美信环境工程有限公司,91532900MA6L31401W,云南省-大理白族自治州-大理市-大理经济技术开发区满江片区大凤路北侧（三环郡城对面））,1,14,正常公开,1:2020:0,2:2021:0,3:2022:0,4:2023:0,5::-
泰州泰环环境技术有限公司,91321282MA1Y589L87,江苏省-泰州市-靖江市-靖江市滨江国际商务中心B座608,1,3,正常公开,1:2021:0,2:2022:0,3:2023:0,4::-,5::-
吉林省实丰环境科技服务有限公司,91220104MA1560428E,吉林省-长春市-朝阳区-延安大路987号,1,2,守信名单,1:2019:0,2:2020:0,3:2021:0,4:2022:0,5:2023:0
湖南翰升环境工程有限公司,91430900MAC4T26Q79,湖南省-益阳市-高新区-益阳市金山南路1号万城国际1栋D单元1712,1,1,正常公开,1:2022:5,2:2023:0,3::-,4::-,5::-
大连凝帆环保科技有限公司,91210213MA0Y9BHQ82,辽宁省-大连市-金普新区-大连经济技术开发区红梅小区71栋-15-1号,1,8,守信名单,1:2019:0,2:2020:0,3:2021:0,4:2022:0,5:2023:0
湖北清润环保科技有限公司,91420700MA49FAHXXJ,湖北省-鄂州市-鄂城区-湖北省鄂州市鄂城区新庙镇文华路世纪阳光住宅小区2号楼1-01铺,1,0,正常公开,1:2020:0,2:2021:5,3:2022:0,4:2023:0,5::-
哈尔滨茸昌环保科技有限公司,91230109MA1C7JRR23,黑龙江省-哈尔滨市-呼兰区-利民开发区警官路南、利民大道西柒季城E栋3号商服,1,4,正常公开,1:2022:0,2:2023:0,3::-,4::-,5::-
贵州智信环嘉工程咨询有限公司,91520111MAAL21C8X2,贵州省-贵阳市-花溪区-贵筑街道甲秀南路贵阳恒大文化旅游城11＃地块2＃楼1单元7层3号,1,2,正常公开,1:2022:0,2:2023:0,3::-,4::-,5::-
佛山市绿哲环保科技有限公司,91440607MA4W9TH183,广东省-佛山市-三水区-西南街道康乐路34号207室,1,1,正常公开,1:2020:0,2:2021:0,3:2022:5,4:2023:3,5::-
云南君邦环保科技有限公司,91530900MA6KLQF232,云南省-临沧市-临翔区-西河北路闲庭水榭25幢一楼,1,8,正常公开,1:2021:0,2:2022:0,3:2023:0,4::-,5::-
陕西蔚之都环境科技有限公司,91610132MA6UXB9H16,陕西省-西安市-经济技术开发区-凤城七路18号荣华北经城南区11号楼1303室,1,9,正常公开,1:2019:0,2:2020:0,3:2021:0,4:2022:0,5:2023:0
内蒙古清露环保科技有限公司,91150102341388242N,内蒙古自治区-呼和浩特市-新城区-中山东路波士名人国际1号楼11层11019室,1,5,正常公开,1:2019:0,2:2020:0,3:2021:0,4:2022:0,5:2023:0
郑州新知力科技有限公司,91410105786224443T,河南省-郑州市-金水区-优胜北路1号芯互联大厦12层1202室,1,7,正常公开,1:2021:0,2:2022:0,3:2023:0,4::-,5::-
厦门毅协超环保科技有限公司,91350206MA31XUQ51R,福建省-泉州市-丰泽区-盛世天骄11号楼1001,1,1,正常公开,1:2019:0,2:2020:0,3:2021:5,4:2022:5,5:2023:0
福建省裕丰环保科技有限公司,91350503MA8TLWX26P,福建省-泉州市-丰泽区-城东仕公岭霞美路口黄金大厦4楼407室,1,3,正常公开,1:2021:0,2:2022:5,3:2023:5,4::-,5::-
潍坊市天天工程咨询有限公司,9137070067316515XP,山东省-潍坊市-奎文区-北海路4931号财富国际商务大厦615室,1,2,正常公开,1:2019:0,2:2020:0,3:2021:0,4:2022:0,5:2023:0
新疆信和环宇环保工程技术咨询有限公司,91652801MA782Q3X8Q,新疆维吾尔自治区-巴音郭楞蒙古自治州-库尔勒市-库尔勒市萨依巴格辖区萨依巴格路西侧5栋B区2层,1,5,正常公开,1:2020:5,2:2021:5,3:2022:5,4:2023:0,5::-
苏州正林环境科技有限公司,91320506MA1MXTDX04,江苏省-苏州市-吴中区-苏蠡路蠡谐大厦12层1202室,1,5,正常公开,1:2020:0,2:2021:0,3:2022:0,4:2023:0,5::-
西安润明环境工程有限责任公司,91610113MA6U1XJG24,陕西省-西安市-雁塔区-明德路2号鑫泰园23号楼1单元602室,1,4,正常公开,1:2020:0,2:2021:0,3:2022:0,4:2023:5,5::-
长沙昌博咨询有限公司,91430111MA7LU4273R,湖南省-长沙市-雨花区-洞井街道时代阳光大道216号湖南全洲医药物流科技有限公司综合楼附楼-102,1,12,正常公开,1:2022:5,2:2023:10,3::-,4::-,5::-
贵州亿航创博环保技术咨询有限公司,91520181MA6HDD9J2F,贵州省-贵阳市-清镇市-前进路38号,1,7,正常公开,1:2022:0,2:2023:10,3::-,4::-,5::-
新疆天润坤成环保科技有限公司,91650105MA784Q9E12,新疆维吾尔自治区-乌鲁木齐市-水磨沟区-温泉东路1号世界公元2期3号楼3单元501室,1,8,正常公开,1:2020:0,2:2021:0,3:2022:0,4:2023:0,5::-
广西景衡环境科技有限公司,91450103MA5PBT673L,广西壮族自治区-南宁市-青秀区-长湖路62号凤景湾7号楼1单元七层702号房,1,0,正常公开,1:2021:0,2:2022:0,3:2023:5,4::-,5::-
青海智力达工程咨询有限公司,91630104MA754MWW18,青海省-西宁市-城西区-西川南路76号4号楼11006室,1,7,正常公开,1:2020:0,2:2021:0,3:2022:0,4:2023:0,5::-
广东霏凡环保技术有限公司,91440803MA51RKUP4G,广东省-湛江市-霞山区-人民大道南45号国贸大厦第五幢四层38号商铺,1,4,正常公开,1:2020:0,2:2021:0,3:2022:0,4:2023:0,5::-
山东冠球环保科技有限公司,91370800MA3BXJ5W8L,山东省-济宁市-高新技术产业开发区-济宁高新区红星国际2320室,1,0,正常公开,1:2019:0,2:2020:0,3:2021:0,4:2022:0,5:2023:0
新疆邦康设计咨询服务有限公司,91650103MA79KX4R35,新疆维吾尔自治区-乌鲁木齐市-沙依巴克区-阿勒泰路嘉和园小区,1,5,正常公开,1:2021:0,2:2022:5,3:2023:0,4::-,5::-
河北海航企业管理咨询有限公司,91130104685734268R,河北省-石家庄市-桥西区-南二环西路31号昊邦大厦A509室,1,6,正常公开,1:2019:0,2:2020:0,3:2021:0,4:2022:5,5:2023:0
